{
  "$schema": "../schema/signoff-checklist.schema.json",
  "id": "signoff-checklist",
  "type": "signoff-checklist",
  "version": 7,
  "versionDate": "2026-10-04",
  "description": "The checklist the Sign-Off runs a scene against, as data rather than prose, so that adding a check is a recorded act with a version bump behind it. A scene's seal records the version it cleared; when this file's version rises, every scene sealed under an older one becomes STALE against the specific checks it never faced, and re-clearing it is a targeted look at those checks alone rather than a fresh review. design/scene-signoff.md is the procedure; this is its content.",
  "notes": "Written 2026-09-22 from Ingram's brief. Every check is phrased as a question with one right answer, because a check phrased as a topic ('consider pacing') cannot be cleared and so never is. `auto` names the evaluator in tools/scene-signoff/checklist.mjs for the mechanically decidable subset -- roughly a third; the rest are read by hand and answered in the pass output. A check with auto:null is not softer, it is only unmechanisable. v2, same day, from the first dry run (The Road In): P4 was asking two questions and verifying one, M5 passed vacuously on an empty cast, recommended checks ignored an exemption the author had already written into the scene's own notes, and nothing asked whether the beat structure describes what will actually happen. Plus the consequence radar (M23/M24/Q17), Ingram's own addition. Applicability added the same day, after the second dry run found that 7 of 63 checks cannot be answered for a six-spotlight montage with no NPCs -- and that a manual check had no way to say so, leaving a reviewer to invent an answer or silently skip it, the latter being indistinguishable from forgetting. `appliesWhenAuto` decides the structural cases; a per-scene `notApplicable` entry on the review record handles the rest. No version bump: narrowing when a check applies cannot make an already-sealed scene wrong. v3, same day, from Ingram's answers to the first report's three questions: long-horizon payoffs are suspect until reviewed against their source (M27), the Place pass writes back into the location file rather than only reading it (P11/P12), and any location a scene touches owes real depth (P6, raised to required). v4, same day: the Seam pass. Ingram noticed that nothing in the process compared a scene to the one it leads into -- specifically whether both ends have valid positions for the whole party, who travels together, and who splits up. Four passes became five, and it is the first pass whose subject is a JOIN rather than a scene. v5, same day: the Seam pass reworked from togetherness to COORDINATES after Ingram corrected a miscommunication -- every scene edge owes a real locationRef, because that is what the runner's automatic cut to the world map fires on. S11 added to check the cut actually happens. v6, 2026-09-24: Q18, contamination. Ingram, settling N20 (LEDGER #34): \"We can store files where ever we like, but we must make sure our scenes never contaminate with information which the players shouldn't know yet.\" Q7 asks whether a deliberate disclosure is right; Q18 asks whether anything reached the table that nobody meant to disclose. v7, 2026-10-04: M28 and M29, objectives (design/objectives.md, D057). Every objective is given by someone in the world, in their own words; a scene that gives one is where that rule is kept or broken at the table.",
  "passes": [
    {
      "id": "comprehension",
      "order": 1,
      "name": "Comprehension",
      "question": "Do I understand what I would be asked to do at the table, and does the story of this scene hold up?",
      "output": "One flowing narration of the whole scene, start to finish, in the order it happens, as the GM would run it. Verbatim on every read-aloud, every NPC's opening line, every choice put to the players, and every roll with its skill, DC and outcomes. Nothing summarised that a GM would have to say out loud.",
      "verdicts": [
        "CLEAR",
        "FIX",
        "STOP"
      ],
      "gate": "A STOP here ends the sign-off. If the story of the scene is bad or makes no sense there is no point auditing its fields or polishing its prose.",
      "stoppingRule": "CLEAR the moment Ingram says she understands the scene and wants it to exist. Comprehension is not a quality pass and may not raise craft findings; those wait for pass 4."
    },
    {
      "id": "completeness",
      "order": 2,
      "name": "Completeness",
      "question": "Is anything missing that the scene needs, or that would help it?",
      "output": "The required checks as a pass/fail table, then the recommended ones as a ranked list of at most five, each with what it would add and what it would cost. Every recommended check deliberately declined is named out loud with its reason.",
      "verdicts": [
        "CLEAR",
        "FIX"
      ],
      "gate": "Every `required` check must pass or be explicitly waived with a reason written into the scene's own notes. A recommended check may be declined freely.",
      "stoppingRule": "CLEAR when the required table is green. Recommended items are offers, not debt: declining all of them is a legitimate CLEAR."
    },
    {
      "id": "place",
      "order": 3,
      "name": "Place",
      "question": "Does this scene happen somewhere real on the world map, and is that the right somewhere?",
      "output": "The map crop -- the site and its surroundings, both zooms, captioned with the location's name, id, grid reference and area -- sent as an image, with what the brief claims about the place set against what the map actually shows. If no location exists, a proposal: the best candidate found on the map, or a request for Ingram to draw one.",
      "verdicts": [
        "CLEAR",
        "FIX",
        "BLOCKED"
      ],
      "gate": "A scene with no location on the map is not finished. Ingram's rule, 2026-09-22: 'if it doesn't have a location then it's not finished yet.' BLOCKED is for when the answer needs her to draw or place something, and is a legitimate resting state -- the sign-off continues to pass 4 and the seal waits.",
      "stoppingRule": "CLEAR when Ingram has looked at the crop and said the siting is right. Her eye on the image is the check; my opinion of the siting is only the proposal."
    },
    {
      "id": "seam",
      "order": 4,
      "name": "Seam",
      "question": "Does this scene join cleanly to the one before it and the one after it?",
      "output": "The two joins, each stated as a movement: where the previous scene leaves every PC, how they get here, and where this scene leaves them for the next one. Distances and travel times where the locations are real. Then what carries across physically -- kit, documents, injuries, information -- and what is deliberately dropped. If the party can arrive or leave in pieces, how the GM runs that and how they recombine.",
      "verdicts": [
        "CLEAR",
        "FIX",
        "STOP"
      ],
      "gate": "A seam fault is usually cheap to fix and expensive to discover at the table, because it surfaces as the GM improvising a journey mid-session. A STOP here means the two scenes cannot both be true as written -- the order is wrong, or one of them has to move.",
      "stoppingRule": "CLEAR when both joins are stated as movements a GM could narrate without inventing anything, and every PC has a position at each edge. The first and last scenes of an episode each have one open edge; say so rather than inventing a neighbour for them."
    },
    {
      "id": "quality",
      "order": 5,
      "name": "Quality",
      "question": "Is this good, and where is the best available improvement?",
      "output": "At most five findings, ranked by how much each would change what the table experiences, each with the current text and a proposed replacement. Obvious fixes are applied and shown as done; anything touching meaning, reveal timing or character is proposed and waits. Then the things I considered and judged fine, named, so that silence is not mistaken for inattention.",
      "verdicts": [
        "CLEAR",
        "FIX",
        "STOP"
      ],
      "gate": "STOP is available here and means the scene is well-built but not worth running -- a different fault from pass 1's STOP, and rarer.",
      "stoppingRule": "Two rounds of FIX, no more. On the third pass through, every remaining finding is either applied or dropped with a one-line reason, and the pass CLEARs. A critique loop with no terminator is not a quality process; it is a way of never finishing."
    }
  ],
  "checks": [
    {
      "id": "C1",
      "pass": "comprehension",
      "severity": "required",
      "auto": null,
      "question": "Can I state what this scene is for in one sentence, without re-reading the file?",
      "why": "If the purpose will not compress, the scene has more than one purpose and the table will feel the seam.",
      "source": "design/narrative-theory-foundations.md"
    },
    {
      "id": "C2",
      "pass": "comprehension",
      "severity": "required",
      "auto": null,
      "question": "Did I narrate the opening exactly as I would say it, rather than describing what the opening does?",
      "why": "Ingram cannot review what she would be asked to do until she has heard it. Paraphrase hides every fault in the words themselves.",
      "source": "Ingram, 2026-09-22"
    },
    {
      "id": "C3",
      "pass": "comprehension",
      "severity": "required",
      "auto": null,
      "question": "Is every speaking NPC's first line quoted verbatim, in their own voice?",
      "why": "An NPC's first line is where the table decides who they are. It is also where written-not-spoken dialogue is most visible.",
      "source": "design/dialogue-and-character-voice.md"
    },
    {
      "id": "C4",
      "pass": "comprehension",
      "severity": "required",
      "auto": null,